[
  {
    "id": 1,
    "type": "小公司老板",
    "willingToPayFor": ["想让员工效率高一点，但不想招人", "想在客户面前显得专业和科技感", "想省掉重复性工作的人力成本"],
    "aiMisconceptions": ["AI能替代员工", "用AI就不用花钱了", "AI做出来的东西肯定好"],
    "approach": "不讲技术，讲省钱省时间。用具体数字。给他看同行案例。",
    "firstMessage": "X总您好，我是V，做AI自动化的。最近帮XX行业的几家小公司做了效率提升方案，平均省了40%的人工时间。",
    "firstCallSteps": ["先问团队几个人，最耗时间的工作是什么", "再问省下来的时间打算做什么", "然后说之前帮类似公司做了什么效果", "最后问预算大概在什么范围"],
    "budgetIndicators": ["之前有没有找人做过类似的优化", "团队现在用什么工具", "公司规模"],
    "pricingStrategy": "先报低价体验价（800-1500），让他试一次。第一次交付满意后再推月度/年度方案。",
    "closingTactics": ["限时优惠：这个月首次合作打8折", "降低门槛：先做一个小模块试试，不满意不收钱", "社交证明：XX公司上个月刚做了"]
  },
  {
    "id": 2,
    "type": "留学机构",
    "willingToPayFor": ["文书批量生成和优化", "学生咨询自动回复", "学校信息检索系统", "社交媒体内容批量产出"],
    "aiMisconceptions": ["AI能直接写出能用的文书", "用了AI就不需要文书老师了", "AI文书会不会被学校检测出来"],
    "approach": "强调AI是辅助不是替代。用效率说话。讲安全性：私有部署，数据不会泄露。",
    "firstMessage": "您好，我是V，做AI效率提升的。最近帮一家留学机构做了文书辅助系统，文书老师的产出效率提高了150%。",
    "firstCallSteps": ["问有多少文书老师，每人每天能写几篇", "问写一篇文书需要多长时间", "如果AI能缩短初稿生成时间，愿意投入多少", "先做个Demo看看效果"],
    "budgetIndicators": ["留学机构利润率高，一般有预算", "用什么系统管理学生", "有多少学生"],
    "pricingStrategy": "文书辅助系统3000-5000元。客户咨询Bot 1500-2000元。打包方案优惠。",
    "closingTactics": ["申请季快到了，现在部署正好赶上旺季", "提供免费试用", "用同行压力"]
  },
  {
    "id": 3,
    "type": "教育培训机构",
    "willingToPayFor": ["课程咨询自动回复", "学员管理系统自动化", "课程内容批量生成", "招生海报批量制作"],
    "aiMisconceptions": ["AI能帮我招生", "AI做的海报能用吗", "培训行业用AI会不会显得不专业"],
    "approach": "从省人力切入。从响应速度切入。用案例说话。",
    "firstMessage": "您好，我帮几家教育机构做了AI咨询回复系统，家长咨询秒回，转化率提升了30%。",
    "firstCallSteps": ["问招生旺季一天有多少咨询", "问咨询是谁在回复，回复速度怎么样", "如果有AI先做初步回复能省多少人力"],
    "budgetIndicators": ["教育机构现金流波动大", "用什么招生系统", "有多少校区"],
    "pricingStrategy": "咨询Bot 1500元。学员管理自动化2000-3000元。海报批量生成800-1500元。",
    "closingTactics": ["开学季/暑假快到了", "先做咨询Bot验证效果", "提供ROI计算"]
  },
  {
    "id": 4,
    "type": "金融自媒体",
    "willingToPayFor": ["每日市场分析自动生成", "数据图表自动制作", "社交媒体内容批量产出", "粉丝互动自动化"],
    "aiMisconceptions": ["AI写的文章能看吗", "AI分析的股票能信吗", "用AI会不会掉粉"],
    "approach": "用金融背景建立信任。强调AI是初稿。用效率说话。",
    "firstMessage": "您好，看您做的金融内容很专业。我是NTU金融本科毕业的，最近在做AI+金融的自动化方案。",
    "firstCallSteps": ["问每天花多少时间在内容制作上", "问最耗时的环节是什么", "如果AI能自动化数据收集和初稿生成，省下来的时间打算做什么"],
    "budgetIndicators": ["金融自媒体变现能力强", "有团队还是一个人做", "粉丝量"],
    "pricingStrategy": "每日市场摘要自动化2000-3000元。数据图表自动化1500-2000元。",
    "closingTactics": ["市场天天在动，早一天用上就早一天省时间", "先做免费Demo展示效果", "强调金融专业性"]
  },
  {
    "id": 5,
    "type": "投研个人/投顾团队",
    "willingToPayFor": ["数据自动抓取和整理", "研报自动生成", "客户报告自动化", "投资组合监控"],
    "aiMisconceptions": ["AI能帮我炒股赚钱", "AI分析比人准", "数据自动化很简单"],
    "approach": "强调效率而非预测能力。用金融专业性建立信任。具体场景切入。",
    "firstMessage": "您好，我是NTU金融毕业的，最近在做投研数据自动化。帮一个投顾团队做了每日数据抓取+自动整理，每天省了2小时。",
    "firstCallSteps": ["问每天花多少时间在数据整理上", "问数据来源有哪些", "如果数据自动抓取整理生成图表，省下来的时间能多做多少研究"],
    "budgetIndicators": ["投顾团队收入不错", "用Wind还是其他终端", "个人投研者预算有限"],
    "pricingStrategy": "单一数据源自动化3000元。多数据源+自动报告5000-8000元。持续维护1000元/月。",
    "closingTactics": ["行情不等人", "先做数据抓取Demo展示效果", "用金融术语建立信任"]
  },
  {
    "id": 6,
    "type": "游戏公司",
    "willingToPayFor": ["游戏美术资源批量生成", "NPC对话脚本生成", "游戏测试自动化", "社区内容管理"],
    "aiMisconceptions": ["AI能画出游戏级别的美术", "AI生成的角色能直接用", "用AI做游戏会不会被玩家骂"],
    "approach": "从辅助切入，不替代美术。从效率切入。展示AI生图能力。",
    "firstMessage": "您好，我在做AI视觉内容生产方案。最近帮一个团队做了游戏角色概念图批量生成，从2周缩短到2天。",
    "firstCallSteps": ["问美术团队几个人，出一套角色概念图需要多久", "如果AI能快速生成大量概念图供美术参考，能省多少前期时间", "问对AI美术的接受度怎么样"],
    "budgetIndicators": ["游戏公司一般有美术外包预算", "现在有外包美术吗", "小独立游戏团队预算有限"],
    "pricingStrategy": "概念图批量生成2000-5000元。角色IP设计3000-8000元。美术风格探索方案2000-3000元。",
    "closingTactics": ["项目排期紧的话概念图用AI能省不少时间", "先免费出3张概念图Demo", "强调AI出概念图，美术精修"]
  },
  {
    "id": 7,
    "type": "内容团队/MCN",
    "willingToPayFor": ["内容批量生成", "配图自动化", "多平台分发自动化", "数据分析和选题推荐"],
    "aiMisconceptions": ["AI写的内容能直接发", "AI能预测爆款", "用AI做内容会不会被平台限流"],
    "approach": "从产能切入。从成本切入。强调AI是辅助不是替代。",
    "firstMessage": "您好，我在做AI内容生产方案。帮一个MCN团队搭了内容自动化流程，内容产出量提升了3倍。",
    "firstCallSteps": ["问团队一天能产出多少内容", "问最耗时的环节是什么", "如果这些环节能自动化一部分，省下来的人力打算怎么用"],
    "budgetIndicators": ["MCN一般有内容制作预算", "有多少账号在运营", "有专门的内容团队吗"],
    "pricingStrategy": "内容生成方案2000-3000元。配图自动化800-1500元。全流程自动化5000-8000元。",
    "closingTactics": ["内容这行拼的就是产出速度", "先做一个行业Demo展示效果", "提供一周免费试用"]
  },
  {
    "id": 8,
    "type": "本地商家",
    "willingToPayFor": ["店铺介绍/菜单自动回复", "社交媒体内容", "客户评价自动回复", "简单的预约/下单自动化"],
    "aiMisconceptions": ["AI跟我有什么关系", "我就是个小店，用不着AI", "AI能帮我多赚钱吗"],
    "approach": "从最简单的场景切入。用成本说话。不说AI，说智能助手或自动回复。",
    "firstMessage": "老板您好，我看您家店在大众点评上评价很好。想问下您平时回复客户咨询忙不忙？",
    "firstCallSteps": ["问一天大概有多少客户在线咨询", "问这些咨询是谁在回复，占多少时间", "如果有个智能助手帮您自动回复常见问题，能省多少事"],
    "budgetIndicators": ["本地商家预算有限，500-1500是心理价位", "有没有做线上推广", "连锁店比个体户预算多"],
    "pricingStrategy": "简单自动回复500-800元。智能客服+预约1000-1500元。不要报高价。",
    "closingTactics": ["现在做正好赶上旺季", "先免费做一个简单Demo", "强调比请兼职便宜"]
  },
  {
    "id": 9,
    "type": "跨境电商",
    "willingToPayFor": ["产品描述多语言翻译和优化", "亚马逊/Shopify listing批量生成", "客户邮件自动回复", "市场调研数据分析"],
    "aiMisconceptions": ["AI翻译能直接用", "AI能帮我选品", "用AI写listing会不会被平台惩罚"],
    "approach": "从多语言切入。从批量切入。用效率说话。",
    "firstMessage": "您好，我在做AI+跨境电商的效率方案。帮一个卖家做了listing批量生成+多语言翻译，原来一个SKU要花2小时，现在15分钟搞定。",
    "firstCallSteps": ["问有多少SKU", "每个SKU的listing制作需要多长时间", "多语言翻译是自己做还是外包"],
    "budgetIndicators": ["跨境电商利润率不错", "月销售额大概多少", "用什么ERP"],
    "pricingStrategy": "Listing批量生成1500-3000元。多语言翻译优化2000-4000元。客户邮件自动化1500-2000元。",
    "closingTactics": ["旺季快到了", "先免费翻译3个listing让他对比效果", "用ROI说话"]
  },
  {
    "id": 10,
    "type": "传统行业老板",
    "willingToPayFor": ["公司数字化转型咨询", "简单的自动化工具", "官网/小程序制作", "员工培训"],
    "aiMisconceptions": ["AI太复杂了，我们用不了", "AI要花很多钱", "AI能替代所有人吗"],
    "approach": "不说AI，说自动化工具或智能系统。从最简单的痛点切入。用最朴素的语言。",
    "firstMessage": "X总您好，我是V，做企业效率提升的。帮几家XX行业的公司做了流程优化，平均省了30%的重复工作时间。",
    "firstCallSteps": ["问公司多少人，主要做什么业务", "问日常工作中最耗时间的环节是什么", "如果这个环节能省一半时间，对公司业务有什么影响", "先做个简单方案看看，不收费"],
    "budgetIndicators": ["传统行业老板看值不值不看贵不贵", "之前有没有做过类似的优化", "年营收500万以上的有预算"],
    "pricingStrategy": "先报低价试水1000-2000元。效果好再推长期方案。用ROI计算说服他。",
    "closingTactics": ["方案您看了吗？最近单子比较多排期比较紧", "面对面沟通效果最好", "强调不试试怎么知道好不好"]
  },
  {
    "id": 11,
    "type": "咨询公司",
    "willingToPayFor": ["研究报告辅助生成", "客户数据整理和分析", "内部知识库搭建", "演示材料自动化"],
    "aiMisconceptions": ["AI写的报告能给客户看吗", "用AI是不是不专业", "AI会不会泄露客户数据"],
    "approach": "强调辅助。强调私有部署。用效率说话。",
    "firstMessage": "您好，我在做AI效率提升方案。帮一家咨询公司做了研究报告辅助系统，报告撰写效率提升了60%。",
    "firstCallSteps": ["问团队现在写一份报告需要多长时间", "问最耗时的环节是什么", "如果AI能把数据收集和初稿撰写自动化，省下来的时间能多接几个项目"],
    "budgetIndicators": ["咨询公司利润率高，一般有预算", "团队多少人", "用什么工具做分析"],
    "pricingStrategy": "知识库搭建3000-5000元。报告辅助系统4000-8000元。数据分析自动化3000-5000元。",
    "closingTactics": ["项目排期紧不紧", "先做一个部门的Demo展示效果", "强调私有部署数据安全"]
  },
  {
    "id": 12,
    "type": "自由职业者/个人IP",
    "willingToPayFor": ["个人品牌内容自动化", "粉丝互动自动化", "课程/产品自动化", "数据分析"],
    "aiMisconceptions": ["AI能帮我涨粉吗", "AI做的内容能保持我的风格吗", "用AI会不会掉粉"],
    "approach": "从效率切入。强调风格一致性。用具体案例说话。",
    "firstMessage": "您好，看您做的内容很专业。我帮几个同类型的博主做了AI辅助内容方案，效率提升了3倍。",
    "firstCallSteps": ["问每天花多少时间在内容上", "问最耗时的环节是什么", "如果AI能帮你把内容产出效率提升3倍，你打算怎么用省下来的时间"],
    "budgetIndicators": ["个人IP变现能力强弱不一", "有没有付费工具预算", "粉丝量和变现方式"],
    "pricingStrategy": "内容生成方案1000-2000元。粉丝互动自动化800-1500元。全套方案3000-5000元。",
    "closingTactics": ["内容这行拼的就是产出速度", "先做一个Demo展示效果", "强调风格一致性"]
  }
]
